{
  "schemaVersion": "elegy-piloting-action-intent/v1",
  "actionId": "select-default-cube",
  "targetId": "blender.desktop",
  "surfaceId": "blender.desktop.main-window",
  "operation": "select_object",
  "description": "Select the default cube in the main 3D workspace.",
  "inputSchema": {
    "type": "object",
    "additionalProperties": false,
    "properties": {
      "objectName": { "type": "string" }
    },
    "required": ["objectName"]
  },
  "sideEffectClass": "desktop_ui",
  "requiredConfirmation": "advisory"
}
